{
  "version": 1,
  "family": "acp_delegate",
  "contract": "socket-readiness/acp-session/v1",
  "collection": {
    "status": "not_collected",
    "live_probe_performed": false,
    "expires_at": null
  },
  "future_checks": [
    "runner_declared",
    "transport_available",
    "session_openable_without_turn"
  ],
  "forbidden_actions": [
    "send_prompt",
    "invoke_model",
    "consume_quota",
    "read_credentials",
    "persist_session"
  ],
  "implementation": {
    "collector": false,
    "eligibility_binding": false
  }
}
